"subreddit","title","selftext","url","sentiment","upvotes","created_at"
CryptoMarkets,Can FHE help to achieve higher data privacy and safety level in AI?,we are half way through 2024 and we can definitely say that AI is one of the most hyped narratives o,https://www.reddit.com/r/CryptoMarkets/comments/1dnmes5/can_fhe_help_to_achieve_higher_data_privacy_and/,0.98,3,2024-06-24 15:42:56,2024-06-28 01:33:39
CryptoMarkets,Mt. Gox to begin $9 billion repayment plan in July,,https://www.reddit.com/r/CryptoMarkets/comments/1dncejb/mt_gox_to_begin_9_billion_repayment_plan_in_july/,0.0,6,2024-06-24 08:34:57,2024-06-28 01:33:39
CryptoMarkets,Are we really in a bull cycle?,Jesus christ are my alts nosediving by 30 - 40% Is this near the top or are we expecting for prices ,https://www.reddit.com/r/CryptoMarkets/comments/1dn6h40/are_we_really_in_a_bull_cycle/,-0.4329,15,2024-06-24 01:59:54,2024-06-28 01:33:39
CryptoMarkets,"Monday Crypto Update: Market Faces TVL Decline, Bitcoin and Ethereum Prices Drop Amid Fundraising Slowdown",,https://www.reddit.com/r/CryptoMarkets/comments/1dnfzzv/monday_crypto_update_market_faces_tvl_decline/,-0.2732,2,2024-06-24 11:17:49,2024-06-28 01:33:39
CryptoMarkets,Which Solana Memecoin Has the Most Potential?,"Which one do you think has the most potential: Samoyedcoin (SAMO), SolDoge (SDOGE), Cheems Inu (CINU",https://www.reddit.com/r/CryptoMarkets/comments/1dnyxhz/which_solana_memecoin_has_the_most_potential/,0.0,0,2024-06-25 02:00:55,2024-06-28 01:33:39
CryptoMarkets,Orbitt MM: AI Volume Booster For Solana Projects,,https://www.reddit.com/r/CryptoMarkets/comments/1dn88gu/orbitt_mm_ai_volume_booster_for_solana_projects/,0.0,8,2024-06-24 04:03:23,2024-06-28 01:33:39
CryptoMarkets,Defunct Mt Gox to start repaying creditors After a Decade,,https://www.reddit.com/r/CryptoMarkets/comments/1dnjlbf/defunct_mt_gox_to_start_repaying_creditors_after/,0.0,1,2024-06-24 13:46:04,2024-06-28 01:33:39
CryptoMarkets,Mt. Gox Trustee to Begin Bitcoin and Bitcoin Cash Repayments,,https://www.reddit.com/r/CryptoMarkets/comments/1dnhoyr/mt_gox_trustee_to_begin_bitcoin_and_bitcoin_cash/,0.25,1,2024-06-24 12:27:58,2024-06-28 01:33:39
CryptoMarkets,Mt. Gox to Begin Bitcoin and Bitcoin Cash Repayments in July 2024,,https://www.reddit.com/r/CryptoMarkets/comments/1dn9ern/mt_gox_to_begin_bitcoin_and_bitcoin_cash/,0.0,4,2024-06-24 05:29:53,2024-06-28 01:33:39
Bitcoin,Bitcoin Newcomers FAQ - Please read!,# Welcome to the /r/Bitcoin Newcomers FAQ You've probably been hearing a lot about Bitcoin recently ,https://www.reddit.com/r/Bitcoin/comments/1bg5lv0/bitcoin_newcomers_faq_please_read/,0.9997,192,2024-03-16 09:02:34,2024-06-28 01:33:39
Bitcoin,"Daily Discussion, June 27, 2024",Please utilize this sticky thread for all general **Bitcoin** discussions! If you see posts on the f,https://www.reddit.com/r/Bitcoin/comments/1dpkam2/daily_discussion_june_27_2024/,0.9272,16,2024-06-27 02:08:41,2024-06-28 01:33:39
Bitcoin,after all these years my country finally legalized cryptocurrencies and I couldn't be happier,"This is a great day for me, I got into crypto in oct 2021 some time after that got royally screwed b",https://www.reddit.com/r/Bitcoin/comments/1dq0wah/after_all_these_years_my_country_finally/,-0.7927,82,2024-06-27 16:13:40,2024-06-28 01:33:39
Bitcoin,FIAT always becomes worthless - it's cheaper to tile with pennies than porcelain - pretty tho!,,https://www.reddit.com/r/Bitcoin/comments/1dprbla/fiat_always_becomes_worthless_its_cheaper_to_tile/,0.1511,224,2024-06-27 09:29:53,2024-06-28 01:33:39
Bitcoin,Government selling is bullish,Gordon Brown famously sold half of UK's Gold reserves for less than $300/ounce. One of the worst dec,https://www.reddit.com/r/Bitcoin/comments/1dpu3lw/government_selling_is_bullish/,-0.8658,143,2024-06-27 11:30:04,2024-06-28 01:33:39
Bitcoin,Bitcoins is for criminals only - right? Tens of billion Euro tax fraud trial against banker dropped on health grounds,,https://www.reddit.com/r/Bitcoin/comments/1dpy7cn/bitcoins_is_for_criminals_only_right_tens_of/,-0.8176,51,2024-06-27 14:20:41,2024-06-28 01:33:39
Bitcoin,Do you continue buying when the market is stagnant if the idea is to average down?,My average is 54k with quite a few different positions. I want to buy more but it will increase my a,https://www.reddit.com/r/Bitcoin/comments/1dpsvwi/do_you_continue_buying_when_the_market_is/,0.7965,83,2024-06-27 10:39:47,2024-06-28 01:33:39
Bitcoin,'the world's best store of value' Bitcoin poster art,,https://www.reddit.com/r/Bitcoin/comments/1dpungu/the_worlds_best_store_of_value_bitcoin_poster_art/,0.765,45,2024-06-27 11:54:03,2024-06-28 01:33:39
Bitcoin,Japan’s Metaplanet to buy more Bitcoin amid crumbling Yen,,https://www.reddit.com/r/Bitcoin/comments/1dpxjxg/japans_metaplanet_to_buy_more_bitcoin_amid/,0.0,31,2024-06-27 13:53:40,2024-06-28 01:33:39
Bitcoin,“Inflation is psychological.” Can’t make this stuff up.,,https://www.reddit.com/r/Bitcoin/comments/1dpls9m/inflation_is_psychological_cant_make_this_stuff_up/,0.0,169,2024-06-27 03:51:38,2024-06-28 01:33:39
Bitcoin,Curiosity: Why does huge BTC transactions have multiple recipients?,I am new here and while browsing on [mempool.space](http://mempool.space) I saw a relatively big 50 ,https://www.reddit.com/r/Bitcoin/comments/1dq4582/curiosity_why_does_huge_btc_transactions_have/,0.3939,10,2024-06-27 18:32:43,2024-06-28 01:33:39
Bitcoin,I made my first bitcoin international sale and it was easy and stress free. This is the future!,,https://www.reddit.com/r/Bitcoin/comments/1dpnaj6/i_made_my_first_bitcoin_international_sale_and_it/,0.5707,96,2024-06-27 05:40:19,2024-06-28 01:33:39
Bitcoin,I’m curious.. how much cash/fiat reserves do you keep?,I’m curious how much do people keep in USD cash/fiat reserves before investing? I’ve always been tol,https://www.reddit.com/r/Bitcoin/comments/1dq5ppi/im_curious_how_much_cashfiat_reserves_do_you_keep/,0.9559,6,2024-06-27 19:46:06,2024-06-28 01:33:39
Bitcoin,11 tips for defending your bitcoin from modern scammers - Unchained,,https://www.reddit.com/r/Bitcoin/comments/1dpzlvm/11_tips_for_defending_your_bitcoin_from_modern/,0.0,10,2024-06-27 15:19:02,2024-06-28 01:33:39
Bitcoin,"Kraken, Bitstamp and Coinbase are sending Bitcoin back to the German government, why?",,https://www.reddit.com/r/Bitcoin/comments/1dpuxn2/kraken_bitstamp_and_coinbase_are_sending_bitcoin/,0.0,18,2024-06-27 12:05:46,2024-06-28 01:33:39
Bitcoin,It’s a given that adopting bitcoin could really help a country in economic collapse suffering from hyper inflation. But what does the transition to bitcoin look like?,The citizens are broke. The government has no currency reserves and is printing money as fast as the,https://www.reddit.com/r/Bitcoin/comments/1dq1fn1/its_a_given_that_adopting_bitcoin_could_really/,0.8666,5,2024-06-27 16:35:20,2024-06-28 01:33:39
Bitcoin,Supreme Court limits power of SEC to unilaterally enforce financial fraud regulations,,https://www.reddit.com/r/Bitcoin/comments/1dpsswh/supreme_court_limits_power_of_sec_to_unilaterally/,-0.0516,15,2024-06-27 10:36:02,2024-06-28 01:33:39
Bitcoin,Debate of these old farts is good,I can’t trust us to do anything positively in 4 years with either of these candidates in the white h,https://www.reddit.com/r/Bitcoin/comments/1dq7ryg/debate_of_these_old_farts_is_good/,0.8625,3,2024-06-27 21:29:34,2024-06-28 01:33:39
Bitcoin,"Clearly we are early, but what amount of BTC would be a minimum amount for you to be considered “on board” and able to get a decent chunk of the pie at this point?","In case that title wasn’t clear I will elaborate, I have been using bitcoin since 2011 however I had",https://www.reddit.com/r/Bitcoin/comments/1dplvew/clearly_we_are_early_but_what_amount_of_btc_would/,0.9985,46,2024-06-27 03:58:09,2024-06-28 01:33:39
Bitcoin,Bitcoin is my life raft,"I write this here because no one I know understands Bitcoin, and the encouragement here helps. I’m a",https://www.reddit.com/r/Bitcoin/comments/1dp81ml/bitcoin_is_my_life_raft/,0.6705,381,2024-06-26 16:01:55,2024-06-28 01:33:39
Bitcoin,Payments to customers of bankrupt crypto exchanges Mt.Gox and FTX will balance each other out.,,https://www.reddit.com/r/Bitcoin/comments/1dq1go3/payments_to_customers_of_bankrupt_crypto/,-0.5574,3,2024-06-27 16:36:27,2024-06-28 01:33:39
Bitcoin,Bitcoin Mining Isn’t Driving Texas Power Demand,The mining sector is no exception to the rule that everything is bigger in Texas. The Lone Star Stat,https://www.reddit.com/r/Bitcoin/comments/1dppxr1/bitcoin_mining_isnt_driving_texas_power_demand/,-0.4588,16,2024-06-27 08:20:07,2024-06-28 01:33:39
Bitcoin,'Bitcoin is too complicated' ~US Dollar user,,https://www.reddit.com/r/Bitcoin/comments/1dp254c/bitcoin_is_too_complicated_us_dollar_user/,0.0,667,2024-06-26 11:59:11,2024-06-28 01:33:39
Bitcoin,Bitcoin Optech 307 Podcast: Murch &amp; Mike Schmidt are joined by Hunter Beast and TheCharlatan,,https://www.reddit.com/r/Bitcoin/comments/1dpwtby/bitcoin_optech_307_podcast_murch_mike_schmidt_are/,0.0,6,2024-06-27 13:23:13,2024-06-28 01:33:39
Bitcoin,Finally A Whole Coiner! Not Sure How To Cash It In... Hodl?,Lol,https://www.reddit.com/r/Bitcoin/comments/1dq56jp/finally_a_whole_coiner_not_sure_how_to_cash_it_in/,0.2801,2,2024-06-27 19:20:55,2024-06-28 01:33:39
Bitcoin,"Faced With the Demagoguery of Politicians Everywhere in the World, Bitcoin Is Your Best Bulwark. More than ever, the world needs a monetary system with decentralized, rigorous and serious governance, free from the risk of manipulation and scheming.",,https://www.reddit.com/r/Bitcoin/comments/1dps9ct/faced_with_the_demagoguery_of_politicians/,0.4215,12,2024-06-27 10:12:15,2024-06-28 01:33:39
Bitcoin,"'Bitcoin is for Spend it' - Well I think some people dont understand it, they still dont catch the Bitcoin purpose",,https://www.reddit.com/r/Bitcoin/comments/1dpmusu/bitcoin_is_for_spend_it_well_i_think_some_people/,0.2732,19,2024-06-27 05:09:20,2024-06-28 01:33:39
Bitcoin,Vanguard and Bitcoin ETF,Do you think Vanguard will offer the ETF eventually? I have all my money there and genuinely don’t f,https://www.reddit.com/r/Bitcoin/comments/1dq7pcz/vanguard_and_bitcoin_etf/,0.296,1,2024-06-27 21:25:29,2024-06-28 01:33:39
Bitcoin,Bitcoin Is to Money as Zulu Is to Time,**Bitcoin is a standard.** It is a way to avoid confusion and stick to one thing. Instead of crazy c,https://www.reddit.com/r/Bitcoin/comments/1dpwh84/bitcoin_is_to_money_as_zulu_is_to_time/,-0.8302,6,2024-06-27 13:09:19,2024-06-28 01:33:39
Bitcoin,What are the potential threats of Bitcoin?,Not specifically to Bitcoin. I am talking about Bitcoin adoption. I have been thinking about this. S,https://www.reddit.com/r/Bitcoin/comments/1dq658t/what_are_the_potential_threats_of_bitcoin/,-0.7207,1,2024-06-27 20:06:15,2024-06-28 01:33:39
Bitcoin,Sparrow wallet for android is this legit,Stumbled upon this for android wallet is it legit... sparrowiki there's a download for android but n,https://www.reddit.com/r/Bitcoin/comments/1dq4p5b/sparrow_wallet_for_android_is_this_legit/,0.0,0,2024-06-27 18:58:49,2024-06-28 01:33:39
Bitcoin,DCA Question,"I started DCA $30/day into bitcoin. A month later I added another $20/day, and then another $20/day,",https://www.reddit.com/r/Bitcoin/comments/1dps7ai/dca_question/,0.762,6,2024-06-27 10:09:49,2024-06-28 01:33:39
Bitcoin,My coworkers - BTC ETF = government control and BTC becoming a stock :D,We started talking about Bitcoin at my work today and my coworkers believe that Bitcoin is becoming ,https://www.reddit.com/r/Bitcoin/comments/1dq438r/my_coworkers_btc_etf_government_control_and_btc/,0.8185,1,2024-06-27 18:30:08,2024-06-28 01:33:39
Bitcoin,How much fiat do you keep vs bitcoin?,we all want to yolo full send every dollar into bitcoin but some liquid fiat is needed on a daily ba,https://www.reddit.com/r/Bitcoin/comments/1dpfhxy/how_much_fiat_do_you_keep_vs_bitcoin/,0.8776,43,2024-06-26 21:39:49,2024-06-28 01:33:39
Bitcoin,Do you guys think Bitcoin will replace gold as reserve asset?,"The vast majority of society rejects Bitcoin as a legitimate asset, if I went around my town asking ",https://www.reddit.com/r/Bitcoin/comments/1dpdtw9/do_you_guys_think_bitcoin_will_replace_gold_as/,0.9991,58,2024-06-26 20:16:14,2024-06-28 01:33:39
Bitcoin,Why don’t you run a node?,"If you don’t run a node, why don’t you..? - Price of hardware? - Ongoing running costs? - Hassle of ",https://www.reddit.com/r/Bitcoin/comments/1dpci07/why_dont_you_run_a_node/,0.9166,48,2024-06-26 19:12:58,2024-06-28 01:33:39
Bitcoin,"hello everyone, is it possible to migrate to another wallet without a private key from a multibit, but through a seed phrase, there is no private key because I cannot synchronize the multibit",,https://www.reddit.com/r/Bitcoin/comments/1dq118y/hello_everyone_is_it_possible_to_migrate_to/,-0.4215,0,2024-06-27 16:19:19,2024-06-28 01:33:39
Bitcoin,Is it possible to verify a public node if you're not running your own?,How can a casual user validate the integrity of a public node like one that is configured in Sparrow,https://www.reddit.com/r/Bitcoin/comments/1dpzzuk/is_it_possible_to_verify_a_public_node_if_youre/,0.8299,0,2024-06-27 15:35:38,2024-06-28 01:33:39
Bitcoin,8 bitcoin ($500k) donated to pay for Julian Assange's flight by anon,,https://www.reddit.com/r/Bitcoin/comments/1doq90m/8_bitcoin_500k_donated_to_pay_for_julian_assanges/,-0.1027,1225,2024-06-26 00:44:27,2024-06-28 01:33:39
Bitcoin,Bitcoin Adoption in 2024 | Scarce Digital Asset's Journey,,https://www.reddit.com/r/Bitcoin/comments/1dpqvnz/bitcoin_adoption_in_2024_scarce_digital_assets/,0.0,3,2024-06-27 09:08:39,2024-06-28 01:33:39
Bitcoin,Gov manipulation,Amazing how these govs are all the sudden dumping large amounts of seized Bitcoin all at the same ti,https://www.reddit.com/r/Bitcoin/comments/1dpt6wa/gov_manipulation/,-0.4215,3,2024-06-27 10:52:55,2024-06-28 01:33:39
Bitcoin,Finnaly Ready to buy BTC,"After many hours of reading and investigating, I am now ready to invest a little. Any tips for a new",https://www.reddit.com/r/Bitcoin/comments/1dpmmfi/finnaly_ready_to_buy_btc/,0.8802,7,2024-06-27 04:52:55,2024-06-28 01:33:39
Bitcoin,Sammelklage gegen Kraken / class action lawsuit against Kraken,"Liebe deutsche Kraken-Nutzer, ich bin betroffen von der vorzeitigen Schließung von Positionen bei de",https://www.reddit.com/r/Bitcoin/comments/1dpp1df/sammelklage_gegen_kraken_class_action_lawsuit/,0.9001,6,2024-06-27 07:31:09,2024-06-28 01:33:39
Bitcoin,"⚡ Lightning Thursday! June 27, 2024: Explore the Lightning Network!⚡",The lightning network is a second-layer solution on top of the Bitcoin blockchain that enables quick,https://www.reddit.com/r/Bitcoin/comments/1dplaha/lightning_thursday_june_27_2024_explore_the/,0.9288,6,2024-06-27 03:15:21,2024-06-28 01:33:39
Bitcoin,Struggling with diversification risk,I'm relatively new to the bitcoin space. Started my btc journey in 2021 after listening to the ebook,https://www.reddit.com/r/Bitcoin/comments/1dpvzc1/struggling_with_diversification_risk/,0.9132,0,2024-06-27 12:48:57,2024-06-28 01:33:39
Bitcoin,How many countries was available to buy bitcoin?,Like other currency that were not dollars and euro more like a small country currency MNT. I was won,https://www.reddit.com/r/Bitcoin/comments/1dpv31d/how_many_countries_was_available_to_buy_bitcoin/,0.2389,0,2024-06-27 12:12:01,2024-06-28 01:33:39
Bitcoin,This legend seeing the future in 2014. Bitcoin is #freedomtech,,https://www.reddit.com/r/Bitcoin/comments/1dou9nx/this_legend_seeing_the_future_in_2014_bitcoin_is/,0.0,237,2024-06-26 05:17:25,2024-06-28 01:33:39
Bitcoin,Join The Bitcoin Revolution and Get Rich,,https://www.reddit.com/r/Bitcoin/comments/1dq0280/join_the_bitcoin_revolution_and_get_rich/,0.7003,0,2024-06-27 15:38:26,2024-06-28 01:33:39
Bitcoin,"4 years ago today, the Australian Post Office began offering Bitcoin exchange services.",,https://www.reddit.com/r/Bitcoin/comments/1doz8ed/4_years_ago_today_the_australian_post_office/,0.0,74,2024-06-26 09:56:32,2024-06-28 01:33:39
Bitcoin,Manipulation,"As we constantly get bombarded with information in regards to transfers from old wallets, government",https://www.reddit.com/r/Bitcoin/comments/1dpqm3t/manipulation/,0.504,0,2024-06-27 08:55:44,2024-06-28 01:33:39
Bitcoin,I own Bitcoin since 2017 but today I earned my first satoshis,Today I sold a bag of cornflakes for a few sats to a colleague. I was happy for the first time ever ,https://www.reddit.com/r/Bitcoin/comments/1dox2u2/i_own_bitcoin_since_2017_but_today_i_earned_my/,0.7516,91,2024-06-26 08:12:13,2024-06-28 01:33:39
Bitcoin,I don't understand how I will use BTC when I'm retired?,"Hello, Can someone explain how I can use the BTC to actually pay my expenses once I'm retired? I'd l",https://www.reddit.com/r/Bitcoin/comments/1dp77o0/i_dont_understand_how_i_will_use_btc_when_im/,0.9232,19,2024-06-26 15:28:12,2024-06-28 01:33:39
Bitcoin,Help need ideas for legit purchases,I occasionally purchase bitcoin but it's on my bank statement as money I've sent to coinbase. I don',https://www.reddit.com/r/Bitcoin/comments/1dpjun3/help_need_ideas_for_legit_purchases/,0.7529,3,2024-06-27 01:39:39,2024-06-28 01:33:39
Bitcoin,how to fix my utxos,"hello tycoons, i just learned more about utxos and potential threats to high fees once the main netw",https://www.reddit.com/r/Bitcoin/comments/1dpjjnw/how_to_fix_my_utxos/,-0.1645,2,2024-06-27 01:20:07,2024-06-28 01:33:39
Bitcoin,help me get my money back from Blockchain.com,"I have an account created in 2016 on blockchain.info (now blockchain.com, however I only use the use",https://www.reddit.com/r/Bitcoin/comments/1dpjd7f/help_me_get_my_money_back_from_blockchaincom/,0.4303,4,2024-06-27 01:09:06,2024-06-28 01:33:39
Bitcoin,Coinbase Authentication Issues,Hi all - I buy BTC on a monthly basis and transfer this to cold storage as soon as I buy. Have been ,https://www.reddit.com/r/Bitcoin/comments/1dpo837/coinbase_authentication_issues/,0.6232,1,2024-06-27 06:42:31,2024-06-28 01:33:39
Bitcoin,Bitcoin is already at 100k,"Look, we all know that given a long enough period of time, Bitcoin is clearly going to continue to g",https://www.reddit.com/r/Bitcoin/comments/1dq58u0/bitcoin_is_already_at_100k/,0.9925,0,2024-06-27 19:24:08,2024-06-28 01:33:39
Bitcoin,George,What do you think of this creator? https://youtu.be/lKnZT7nzd8I?si=5xxN_miEBqGf82bk I don’t mind him,https://www.reddit.com/r/Bitcoin/comments/1dpgp1q/george/,0.0,6,2024-06-26 22:39:47,2024-06-28 01:33:39
Bitcoin,BTC YouTubers,Are there any good channels for rational and objective btc content without too much clickbait s**t? ,https://www.reddit.com/r/Bitcoin/comments/1dp1u84/btc_youtubers/,0.9168,21,2024-06-26 11:46:58,2024-06-28 01:33:39
Bitcoin,Why Bitcoin Matters — The Real Value Of BTC Beyond Its Volatility,,https://www.reddit.com/r/Bitcoin/comments/1dovynf/why_bitcoin_matters_the_real_value_of_btc_beyond/,0.3612,48,2024-06-26 07:09:08,2024-06-28 01:33:39
Bitcoin,Turn GC into crypto,"Hello, can I turn my 10 dollar Amazon gift card into crypto? If so, how is it? Iam a newbie",https://www.reddit.com/r/Bitcoin/comments/1dpm5tp/turn_gc_into_crypto/,0.6072,0,2024-06-27 04:18:59,2024-06-28 01:33:39
Bitcoin,Immediate and Long-Term Effects of Bitcoin's Fourth Halving,,https://www.reddit.com/r/Bitcoin/comments/1doy6kj/immediate_and_longterm_effects_of_bitcoins_fourth/,0.0,38,2024-06-26 09:07:16,2024-06-28 01:33:39
Bitcoin,A Bitcoin song,"Hi all, I thought to share my Bitcoin song. Hope you'll like it. I generated it with Suno, trying to",https://www.reddit.com/r/Bitcoin/comments/1dplxgl/a_bitcoin_song/,0.872,0,2024-06-27 04:01:56,2024-06-28 01:33:39
Bitcoin,What your agreements against tail emission forks in the future?,"As the block subsidy decreases and miners rewards drop, how are we outta deal with network security ",https://www.reddit.com/r/Bitcoin/comments/1dpr0ju/what_your_agreements_against_tail_emission_forks/,0.6341,0,2024-06-27 09:15:14,2024-06-28 01:33:39
Bitcoin,Julian Assange is FREE,,https://www.reddit.com/r/Bitcoin/comments/1do4ttg/julian_assange_is_free/,0.6166,2226,2024-06-25 08:30:38,2024-06-28 01:33:39
Bitcoin,"Exactly 5 years ago, the first Bitcoin themed watch was released by Franck Muller.",,https://www.reddit.com/r/Bitcoin/comments/1dpqxmm/exactly_5_years_ago_the_first_bitcoin_themed/,0.0,0,2024-06-27 09:11:16,2024-06-28 01:33:39
Bitcoin,idealMoney{bitcoin{math}},,https://www.reddit.com/r/Bitcoin/comments/1dpi8y6/idealmoneybitcoinmath/,0.0,0,2024-06-27 00:03:45,2024-06-28 01:33:39
Bitcoin,Selling property for BTC in Spain,"Selling property for 4 BTC Spain Throwaway account... Selling my 3 bd. Apartment in Málaga, Spain in",https://www.reddit.com/r/Bitcoin/comments/1dp6p1n/selling_property_for_btc_in_spain/,0.9191,9,2024-06-26 15:06:49,2024-06-28 01:33:39
Bitcoin,"If you aren't using self custody, are the etfs better?",I don't plan on doing self custody likely until sometime after this 12-18 month post-halving run. So,https://www.reddit.com/r/Bitcoin/comments/1dp1yxl/if_you_arent_using_self_custody_are_the_etfs/,0.8092,9,2024-06-26 11:52:23,2024-06-28 01:33:39
Bitcoin,BlackRock's spot #Bitcoin ETF did $1.1 billion in trading volume today WE ARE SO BACK🚀🚀🚀,,https://www.reddit.com/r/Bitcoin/comments/1doh4j3/blackrocks_spot_bitcoin_etf_did_11_billion_in/,0.0,273,2024-06-25 17:18:28,2024-06-28 01:33:39
Bitcoin,An apple a day keeps the Fiat away,I’m seeing more and more talk about Bitcoin than I ever had. Anyone want to share a new thought on B,https://www.reddit.com/r/Bitcoin/comments/1doxvkg/an_apple_a_day_keeps_the_fiat_away/,0.3612,11,2024-06-26 08:52:37,2024-06-28 01:33:39
Bitcoin,"DCA Tools (Roundup, autopayments, etc)",Which dollar cost averaging tools do ya'll reccomend. I heard of RoundlyX a lot but they recently sh,https://www.reddit.com/r/Bitcoin/comments/1dpfrry/dca_tools_roundup_autopayments_etc/,-0.677,1,2024-06-26 21:53:32,2024-06-28 01:33:39
Bitcoin,Total newb to Bitcoin need specific help regarding Russia.,Hi all my wife is Russian and needs to return to Russia for a several weeks to handle some family af,https://www.reddit.com/r/Bitcoin/comments/1dp06ie/total_newb_to_bitcoin_need_specific_help/,0.9273,7,2024-06-26 10:38:09,2024-06-28 01:33:39
Bitcoin,The most legendary Bitcoin clip!,,https://www.reddit.com/r/Bitcoin/comments/1do4ts0/the_most_legendary_bitcoin_clip/,0.0,860,2024-06-25 08:30:35,2024-06-28 01:33:39
Bitcoin,Would you consider BTC a speculative bubble?,"The answer is probably no, but why? Some regular stock traders would say it’s the biggest bubble of ",https://www.reddit.com/r/Bitcoin/comments/1dprchk/would_you_consider_btc_a_speculative_bubble/,0.6072,0,2024-06-27 09:30:53,2024-06-28 01:33:39
Bitcoin,Why Bitcoin Takes All with Michael Goldstein — What Bitcoin Did,,https://www.reddit.com/r/Bitcoin/comments/1doxxed/why_bitcoin_takes_all_with_michael_goldstein_what/,0.0,7,2024-06-26 08:55:06,2024-06-28 01:33:39
Bitcoin,Anybody elses portfolio look like this? [OC],,https://www.reddit.com/r/Bitcoin/comments/1do77us/anybody_elses_portfolio_look_like_this_oc/,0.3612,495,2024-06-25 10:22:37,2024-06-28 01:33:39
Bitcoin,Got Bitcoin?,,https://www.reddit.com/r/Bitcoin/comments/1dpd7kt/got_bitcoin/,0.0,0,2024-06-26 19:46:32,2024-06-28 01:33:39
Bitcoin,How Does Bitcoin fix illegal fishing?,Trying to think through this one,https://www.reddit.com/r/Bitcoin/comments/1dpd1jw/how_does_bitcoin_fix_illegal_fishing/,-0.5574,0,2024-06-26 19:38:24,2024-06-28 01:33:39
Bitcoin,Thank you guys. Fiat isn't it anymore.,I haven't been here for long. So when I joined I learned that we all need our personal freedom with ,https://www.reddit.com/r/Bitcoin/comments/1dof80l/thank_you_guys_fiat_isnt_it_anymore/,0.975,158,2024-06-25 15:59:47,2024-06-28 01:33:39
Bitcoin,Bitcoin Painting 'Bitcollector' that visualizes Bitcoin Collectibles is on Auction on The Bitcoin Forum exclusively for Bitcoin.,,https://www.reddit.com/r/Bitcoin/comments/1dpk5u5/bitcoin_painting_bitcollector_that_visualizes/,0.0,0,2024-06-27 02:00:09,2024-06-28 01:33:39
Bitcoin,Sticking with 100% BTC this bullrun,"I've dca into btc since 2022,i know that from now alts can and probably will outperform btc but im s",https://www.reddit.com/r/Bitcoin/comments/1do98tr/sticking_with_100_btc_this_bullrun/,-0.5267,286,2024-06-25 11:49:00,2024-06-28 01:33:39
Bitcoin,"Daily Discussion, June 26, 2024",Please utilize this sticky thread for all general **Bitcoin** discussions! If you see posts on the f,https://www.reddit.com/r/Bitcoin/comments/1dorkyf/daily_discussion_june_26_2024/,0.9272,21,2024-06-26 02:08:29,2024-06-28 01:33:39
Bitcoin,"Nubank, Latin America's Largest Fintech Bank, Integrates Bitcoin Lightning Payments Via Lightspark",,https://www.reddit.com/r/Bitcoin/comments/1donkp4/nubank_latin_americas_largest_fintech_bank/,0.0,40,2024-06-25 22:19:44,2024-06-28 01:33:39
Bitcoin,Strike App UK quizz answers,"BS UK financial regulation. I failed my 1st try yesterday, had to wait 24 hours and passed on my 2nd",https://www.reddit.com/r/Bitcoin/comments/1dovbff/strike_app_uk_quizz_answers/,-0.971,9,2024-06-26 06:29:03,2024-06-28 01:33:39
Bitcoin,PushTX.org - NFC tap to push signed transactions,,https://www.reddit.com/r/Bitcoin/comments/1dpabkn/pushtxorg_nfc_tap_to_push_signed_transactions/,-0.6633,0,2024-06-26 17:37:34,2024-06-28 01:33:39
Bitcoin,The latest Bitcoin Breakdown newsletter issue is now live. See sneak peeks of the Feature Stories and Tools &amp; Projects sections below. Full issue link is in the comments.,,https://www.reddit.com/r/Bitcoin/comments/1dosttq/the_latest_bitcoin_breakdown_newsletter_issue_is/,0.0,14,2024-06-26 03:33:42,2024-06-28 01:33:39
Bitcoin,"Can only send $12 of bitcoin, Why is this?",,https://www.reddit.com/r/Bitcoin/comments/1dou2tl/can_only_send_12_of_bitcoin_why_is_this/,0.0,11,2024-06-26 05:04:02,2024-06-28 01:33:39
