"subreddit","title","selftext","url","sentiment","upvotes","created_at"
Bitcoin,Bitcoin and Data Corruption,"Those who know more about Bitcoin than i do, i'm hopeful you can help clear up an issue i hypothesis",https://www.reddit.com/r/Bitcoin/comments/1dox23p/bitcoin_and_data_corruption/,0.9062,6,2024-06-26 08:11:07,2024-06-28 01:33:39
Bitcoin,What is your strategy,"Let's say you have some amount of Bitcoins in your hardware wallet. And, let's say late 2025 we'll h",https://www.reddit.com/r/Bitcoin/comments/1doqyod/what_is_your_strategy/,0.9089,13,2024-06-26 01:28:17,2024-06-28 01:33:39
Bitcoin,$130 Trillion of capital from the bond markets will be searching for a store of value in the next decade,,https://www.reddit.com/r/Bitcoin/comments/1do5f5c/130_trillion_of_capital_from_the_bond_markets/,0.34,295,2024-06-25 09:00:14,2024-06-28 01:33:39
Bitcoin,Cause of dip?,This article states the reason BTC dipped is because 40x BTC were transferred to CoinBase and the ma,https://www.reddit.com/r/Bitcoin/comments/1dpbxo5/cause_of_dip/,-0.6486,0,2024-06-26 18:47:43,2024-06-28 01:33:39
Bitcoin,Can't find my wallet/bitcoin,About 3 years ago bought some bitcoin and have recently found it after losing it only I can't actual,https://www.reddit.com/r/Bitcoin/comments/1doxuif/cant_find_my_walletbitcoin/,-0.7346,4,2024-06-26 08:51:10,2024-06-28 01:33:39
Bitcoin,Cash App direct deposit fiat into bitcoin reliability and questions?,I've heard that you can have your paycheck or portion of paycheck sent to Cash App as a direct depos,https://www.reddit.com/r/Bitcoin/comments/1dovzt0/cash_app_direct_deposit_fiat_into_bitcoin/,0.8541,3,2024-06-26 07:11:03,2024-06-28 01:33:39
Bitcoin,When alt coin supporters criticize Bitcoin,,https://www.reddit.com/r/Bitcoin/comments/1do9vhk/when_alt_coin_supporters_criticize_bitcoin/,0.0772,130,2024-06-25 12:15:01,2024-06-28 01:33:39
Bitcoin,Could smart contracts work on Bitcoin Blockchain?,"Could smart contracts work on the Bitcoin blockchain? I’m not a fan of proof of stake, but I see the",https://www.reddit.com/r/Bitcoin/comments/1dp5zkn/could_smart_contracts_work_on_bitcoin_blockchain/,0.9654,0,2024-06-26 14:37:37,2024-06-28 01:33:39
Bitcoin,"I don’t trust hw wallets no more, with their need to firmware-update at first use. What do I do?",I’ve just got a Jade and I really don’t like that I needed internet connection to do a firmware upda,https://www.reddit.com/r/Bitcoin/comments/1dpff2c/i_dont_trust_hw_wallets_no_more_with_their_need/,0.9192,0,2024-06-26 21:35:37,2024-06-28 01:33:39
Bitcoin,How to? Noobie things..,"So I had some crypto stuff going on years ago, but can't remember too much of it. I'd want to start ",https://www.reddit.com/r/Bitcoin/comments/1dp8xng/how_to_noobie_things/,0.8229,0,2024-06-26 16:40:01,2024-06-28 01:33:39
Bitcoin,Florida-based US Congressman Matt Gaetz introduced a bill to allow certain federal taxes be paid with bitcoin,,https://www.reddit.com/r/Bitcoin/comments/1do9gik/floridabased_us_congressman_matt_gaetz_introduced/,0.4588,92,2024-06-25 11:57:59,2024-06-28 01:33:39
Bitcoin,'Sounds Like Freedom' Bitcoin Poster,,https://www.reddit.com/r/Bitcoin/comments/1doe71b/sounds_like_freedom_bitcoin_poster/,0.7717,47,2024-06-25 15:15:43,2024-06-28 01:33:39
Bitcoin,In Kenya thousands are marching against corruption and new tax laws. The government answers with abductions and brutality. Now bank accounts are being frozen. Use self-custody Bitcoin. It can’t be shut down.,,https://www.reddit.com/r/Bitcoin/comments/1do1vmm/in_kenya_thousands_are_marching_against/,-0.7906,285,2024-06-25 05:29:11,2024-06-28 01:33:39
Bitcoin,New to Bitcoin. How do I ensure the safety of my funds?,I am in the process of moving a sizeable amount of fiat into bitcoin. It feels weird to see the numb,https://www.reddit.com/r/Bitcoin/comments/1doowuy/new_to_bitcoin_how_do_i_ensure_the_safety_of_my/,0.8732,9,2024-06-25 23:28:47,2024-06-28 01:33:39
