"subreddit","title","selftext","url","sentiment","upvotes","created_at"
CryptoCurrency,Moon Week 50,"Hello everyone and welcome to Moon Week for round 50 of Moons! For more information about Moons, ple",https://www.reddit.com/r/CryptoCurrency/comments/1dngdfu/moon_week_50/,0.9897,36,2024-06-24 11:33:28,2024-06-28 01:33:39
CryptoCurrency,"Daily Crypto Discussion - June 28, 2024 (GMT+0)",**Welcome to the Daily Crypto Discussion thread. Please read the disclaimer and rules before partici,https://www.reddit.com/r/CryptoCurrency/comments/1dq60jy/daily_crypto_discussion_june_28_2024_gmt0/,0.9539,4,2024-06-27 20:00:21,2024-06-28 01:33:39
CryptoCurrency,Logan Paul Sues YouTuber Coffeezilla Over CryptoZoo Coverage,,https://www.reddit.com/r/CryptoCurrency/comments/1dpznpk/logan_paul_sues_youtuber_coffeezilla_over/,0.0,1270,2024-06-27 15:21:07,2024-06-28 01:33:39
CryptoCurrency,"‘Hawk Tuah’ crypto token soars 1,300% in a week",,https://www.reddit.com/r/CryptoCurrency/comments/1dpq5rc/hawk_tuah_crypto_token_soars_1300_in_a_week/,0.0,295,2024-06-27 08:31:54,2024-06-28 01:33:39
CryptoCurrency,"Bitcoin Wholecoiners Exceed 1 Million, Over $265 Billion Needed For BTC To Break $74,000",,https://www.reddit.com/r/CryptoCurrency/comments/1dq32rm/bitcoin_wholecoiners_exceed_1_million_over_265/,0.0,53,2024-06-27 17:45:01,2024-06-28 01:33:39
CryptoCurrency,"Scaramucci Backs Biden, Warning Against Trump’s Crypto Policy",,https://www.reddit.com/r/CryptoCurrency/comments/1dpz475/scaramucci_backs_biden_warning_against_trumps/,-0.3818,67,2024-06-27 14:58:36,2024-06-28 01:33:39
CryptoCurrency,Dormant Bitcoin miner sends $3m to Binance after 14 years of inactivity,,https://www.reddit.com/r/CryptoCurrency/comments/1dpnzjq/dormant_bitcoin_miner_sends_3m_to_binance_after/,0.0,272,2024-06-27 06:26:57,2024-06-28 01:33:39
CryptoCurrency,‘Groundbreaking’ Bitcoin Bill Introduced To Congress After Crypto Price Crash,,https://www.reddit.com/r/CryptoCurrency/comments/1dpqquh/groundbreaking_bitcoin_bill_introduced_to/,-0.4019,83,2024-06-27 09:02:05,2024-06-28 01:33:39
CryptoCurrency,"Bitcoin whale donates 8 BTC to Julian Assange, covers private jet costs",,https://www.reddit.com/r/CryptoCurrency/comments/1dp79zv/bitcoin_whale_donates_8_btc_to_julian_assange/,0.0,2007,2024-06-26 15:30:45,2024-06-28 01:33:39
CryptoCurrency,Coinbase sues SEC and FDIC for crypto regulatory clarity,,https://www.reddit.com/r/CryptoCurrency/comments/1dpqxvv/coinbase_sues_sec_and_fdic_for_crypto_regulatory/,0.4019,72,2024-06-27 09:11:37,2024-06-28 01:33:39
CryptoCurrency,Vaneck has applied for a Solana ETF!,"Someone asked the director digital assets on twitter if this was an ETF or a Trust, he responded “bo",https://www.reddit.com/r/CryptoCurrency/comments/1dprnf7/vaneck_has_applied_for_a_solana_etf/,0.6476,62,2024-06-27 09:44:54,2024-06-28 01:33:39
CryptoCurrency,"2 years ago today, crypto hedge fund 3AC is ordered into bankruptcy. Today, its investors are still owed billions",,https://www.reddit.com/r/CryptoCurrency/comments/1dpp2yp/2_years_ago_today_crypto_hedge_fund_3ac_is/,0.0,57,2024-06-27 07:33:47,2024-06-28 01:33:39
CryptoCurrency,Decipher Day 01 Recap - Or what is happening on Algorand!,"For those that don't know, Algorand has a professional run blockchain event called Decipher. This ye",https://www.reddit.com/r/CryptoCurrency/comments/1dpvi12/decipher_day_01_recap_or_what_is_happening_on/,0.9834,16,2024-06-27 12:29:21,2024-06-28 01:33:39
CryptoCurrency,"US government transfers 4,000 BTC to Coinbase",,https://www.reddit.com/r/CryptoCurrency/comments/1dp5uxl/us_government_transfers_4000_btc_to_coinbase/,0.0,741,2024-06-26 14:32:04,2024-06-28 01:33:39
CryptoCurrency,"A Bitcoin Miner from the Early Days of Bitcoin, Known as the 'Satoshi Era', Awakened from His 14-Year Sleep!",,https://www.reddit.com/r/CryptoCurrency/comments/1dpt16e/a_bitcoin_miner_from_the_early_days_of_bitcoin/,0.0,16,2024-06-27 10:46:07,2024-06-28 01:33:39
CryptoCurrency,"VanEck Files for Solana ETF, SOL Rises 8%",,https://www.reddit.com/r/CryptoCurrency/comments/1dq4n08/vaneck_files_for_solana_etf_sol_rises_8/,0.0,4,2024-06-27 18:56:03,2024-06-28 01:33:39
CryptoCurrency,Coinbase opts out of ASI token migration as $7.5B merger proceeds,,https://www.reddit.com/r/CryptoCurrency/comments/1dpx87u/coinbase_opts_out_of_asi_token_migration_as_75b/,0.0,7,2024-06-27 13:40:09,2024-06-28 01:33:39
CryptoCurrency,I bought meme coins a few years back and forgot about them,"Well it was a dumb move, I had just started learning about the markets and bought some meme coins fo",https://www.reddit.com/r/CryptoCurrency/comments/1dpkcmu/i_bought_meme_coins_a_few_years_back_and_forgot/,0.8591,59,2024-06-27 02:12:25,2024-06-28 01:33:39
CryptoCurrency,Bitcoin wobbles on sell fears as US moves $240M worth of Bitcoin to Coinbase address - CoinJournal,,https://www.reddit.com/r/CryptoCurrency/comments/1dq26rx/bitcoin_wobbles_on_sell_fears_as_us_moves_240m/,-0.2263,3,2024-06-27 17:07:12,2024-06-28 01:33:39
CryptoCurrency,Arbitrum (ARB) Price Poised to Chart a New All-Time Low,,https://www.reddit.com/r/CryptoCurrency/comments/1dq16bk/arbitrum_arb_price_poised_to_chart_a_new_alltime/,-0.0258,3,2024-06-27 16:25:08,2024-06-28 01:33:39
CryptoCurrency,Coinbase opts out of ASI token merger migration,,https://www.reddit.com/r/CryptoCurrency/comments/1dpg5xx/coinbase_opts_out_of_asi_token_merger_migration/,0.0,60,2024-06-26 22:13:01,2024-06-28 01:33:39
CryptoCurrency,How do I access my Year-End Tax papers from BlockFi now that the platform has been shut down!?,Ok so I received a notice from the IRS *today* that requires information from 2022 end of year forms,https://www.reddit.com/r/CryptoCurrency/comments/1dq0u6k/how_do_i_access_my_yearend_tax_papers_from/,-0.2677,1,2024-06-27 16:11:15,2024-06-28 01:33:39
CryptoCurrency,Robert Kiyosaki Bought 60 Bitcoins at $6K — Now Buys BTC Every Month,,https://www.reddit.com/r/CryptoCurrency/comments/1dq5cb3/robert_kiyosaki_bought_60_bitcoins_at_6k_now_buys/,0.0,1,2024-06-27 19:28:43,2024-06-28 01:33:39
CryptoCurrency,SEC could approve spot Ethereum ETFs by July 4: report,,https://www.reddit.com/r/CryptoCurrency/comments/1dphi6c/sec_could_approve_spot_ethereum_etfs_by_july_4/,0.0,37,2024-06-26 23:23:11,2024-06-28 01:33:39
CryptoCurrency,Best way to withdraw USDT to a USD bank account?,My new employer is going to pay my entire salary in USDT. I will need to regularly convert USDT to U,https://www.reddit.com/r/CryptoCurrency/comments/1dq4pej/best_way_to_withdraw_usdt_to_a_usd_bank_account/,0.9003,0,2024-06-27 18:59:10,2024-06-28 01:33:39
CryptoCurrency,Web3 Blight - Chase Consumers NOT Investors,,https://www.reddit.com/r/CryptoCurrency/comments/1dq2z7i/web3_blight_chase_consumers_not_investors/,0.0,1,2024-06-27 17:40:49,2024-06-28 01:33:39
CryptoCurrency,Coffeezilla the Movie,,https://www.reddit.com/r/CryptoCurrency/comments/1dq2rak/coffeezilla_the_movie/,0.0,0,2024-06-27 17:31:27,2024-06-28 01:33:39
CryptoCurrency,Why so many e-shops offer HUGE discounts if order is paid in crypto?,"10%, 15% sometimes 20 and even 25% off entire order if you choose crypto as a method of payment! Whe",https://www.reddit.com/r/CryptoCurrency/comments/1dpe7j2/why_so_many_eshops_offer_huge_discounts_if_order/,0.8946,42,2024-06-26 20:34:34,2024-06-28 01:33:39
CryptoCurrency,US offers $5M reward for elusive OneCoin CEO Ignatova,The U.S. Department of State has offered a reward of up to $5 million for information leading to the,https://www.reddit.com/r/CryptoCurrency/comments/1dpe0y7/us_offers_5m_reward_for_elusive_onecoin_ceo/,0.7269,45,2024-06-26 20:25:41,2024-06-28 01:33:39
CryptoCurrency,Coffeezilla confronting boogie2988 on crypto scam,,https://www.reddit.com/r/CryptoCurrency/comments/1dq1x1u/coffeezilla_confronting_boogie2988_on_crypto_scam/,-0.6486,1,2024-06-27 16:55:41,2024-06-28 01:33:39
CryptoCurrency,Paradigm calls European markets regulator to show nuance regarding MEV,,https://www.reddit.com/r/CryptoCurrency/comments/1dq0fpn/paradigm_calls_european_markets_regulator_to_show/,0.0,1,2024-06-27 15:54:21,2024-06-28 01:33:39
CryptoCurrency,How does shopping online with ETH work in 2024?,Years ago there was a lot of talk about how crypto is going to replace banks and become an easy way ,https://www.reddit.com/r/CryptoCurrency/comments/1dpuv8l/how_does_shopping_online_with_eth_work_in_2024/,0.9607,2,2024-06-27 12:02:57,2024-06-28 01:33:39
CryptoCurrency,Cyber Attackers Target Cryptocurrency Exchanges for Massive Gains,,https://www.reddit.com/r/CryptoCurrency/comments/1dpusak/cyber_attackers_target_cryptocurrency_exchanges/,-0.3182,1,2024-06-27 11:59:51,2024-06-28 01:33:39
CryptoCurrency,"US spot bitcoin ETFs report $21.5 million in net inflows, extending positive streak",,https://www.reddit.com/r/CryptoCurrency/comments/1dpj6yr/us_spot_bitcoin_etfs_report_215_million_in_net/,0.5574,14,2024-06-27 00:58:47,2024-06-28 01:33:39
CryptoCurrency,"Looking to switch from my old Ledger Nano S to a newer, more secure hardware wallet.","Ledger doesn't have the best track record when it comes to security. Trezor, so far, has been pretty",https://www.reddit.com/r/CryptoCurrency/comments/1dpz3px/looking_to_switch_from_my_old_ledger_nano_s_to_a/,0.9799,0,2024-06-27 14:58:03,2024-06-28 01:33:39
CryptoCurrency,Telegram-Based Notcoin Burns 210 Million Tokens Amid Positive Recovery,,https://www.reddit.com/r/CryptoCurrency/comments/1dq31ki/telegrambased_notcoin_burns_210_million_tokens/,0.5574,0,2024-06-27 17:43:35,2024-06-28 01:33:39
CryptoCurrency,Vitalik Buterin introduces tool for anonymous online voting,,https://www.reddit.com/r/CryptoCurrency/comments/1dp3tfj/vitalik_buterin_introduces_tool_for_anonymous/,0.0,92,2024-06-26 13:07:05,2024-06-28 01:33:39
CryptoCurrency,"Solana ETFs and Huge SOL Gains a Real Possibility Under Trump, Major Crypto Trader Says",,https://www.reddit.com/r/CryptoCurrency/comments/1dq77u9/solana_etfs_and_huge_sol_gains_a_real_possibility/,0.5719,0,2024-06-27 20:59:47,2024-06-28 01:33:39
CryptoCurrency,"Daily Crypto Discussion - June 27, 2024 (GMT+0)",**Welcome to the Daily Crypto Discussion thread. Please read the disclaimer and rules before partici,https://www.reddit.com/r/CryptoCurrency/comments/1dpdhy9/daily_crypto_discussion_june_27_2024_gmt0/,0.9539,23,2024-06-26 20:00:25,2024-06-28 01:33:39
CryptoCurrency,What app should I use to invest in crypto?,I already have a round $600 or so in BTC on cash app but was wondering if there are better apps I co,https://www.reddit.com/r/CryptoCurrency/comments/1dq2g80/what_app_should_i_use_to_invest_in_crypto/,0.9819,0,2024-06-27 17:18:33,2024-06-28 01:33:39
CryptoCurrency,Cardano Unfazed By Failed DDoS Attack Targeting Staked ADA,,https://www.reddit.com/r/CryptoCurrency/comments/1douyqu/cardano_unfazed_by_failed_ddos_attack_targeting/,-0.7506,212,2024-06-26 06:05:52,2024-06-28 01:33:39
CryptoCurrency,The Psychology of the Bitcoin Wholecoiner: FOMO or HODL?,,https://www.reddit.com/r/CryptoCurrency/comments/1dpslss/the_psychology_of_the_bitcoin_wholecoiner_fomo_or/,0.0,3,2024-06-27 10:27:18,2024-06-28 01:33:39
CryptoCurrency,Ethereum’s supply has been inflating for 73 days straight,"The supply of new Ether is in its most extended inflationary spell since the Merge in 2022, and the ",https://www.reddit.com/r/CryptoCurrency/comments/1dosjtd/ethereums_supply_has_been_inflating_for_73_days/,0.4939,304,2024-06-26 03:13:48,2024-06-28 01:33:39
CryptoCurrency,Crypto Market Braces for Volatility as $10B in Bitcoin and Ether Options Set to Expire | CoinMarketCap,Bitcoin (BTC) options worth $6.68 billion and Ethereum (ETH) options worth $3.5 billion are slated t,https://www.reddit.com/r/CryptoCurrency/comments/1dpnz45/crypto_market_braces_for_volatility_as_10b_in/,0.7845,1,2024-06-27 06:26:13,2024-06-28 01:33:39
CryptoCurrency,Bullish? USDC Stablecoin Hits One-Year High in Net Inflows on Crypto Exchanges,,https://www.reddit.com/r/CryptoCurrency/comments/1dpeb2j/bullish_usdc_stablecoin_hits_oneyear_high_in_net/,0.0,13,2024-06-26 20:39:21,2024-06-28 01:33:39
CryptoCurrency,Looking for help getting started. I'm trying very hard to understand but there's SO much jargon. I need to make sure I understand the basics correctly.,"Hey everyone, hoping I can learn something from this. I've never done anything with crypto before bu",https://www.reddit.com/r/CryptoCurrency/comments/1dpfyos/looking_for_help_getting_started_im_trying_very/,0.9914,9,2024-06-26 22:03:01,2024-06-28 01:33:39
CryptoCurrency,Tezos X: A Vision for the Future of Blockchain - XTZ News,"Today, Tezos X has been unveiled, presenting a forward-looking vision for Tezos that marks a signifi",https://www.reddit.com/r/CryptoCurrency/comments/1dpqt2r/tezos_x_a_vision_for_the_future_of_blockchain_xtz/,0.81,0,2024-06-27 09:05:10,2024-06-28 01:33:39
CryptoCurrency,Metallica Joins Growing List of Hacked Celebs Promoting Scam Crypto Tokens,,https://www.reddit.com/r/CryptoCurrency/comments/1doxooc/metallica_joins_growing_list_of_hacked_celebs/,-0.4939,88,2024-06-26 08:43:12,2024-06-28 01:33:39
CryptoCurrency,"Argentinian President Javier Milei Advocates For Bitcoin, Opening Doors To Digital Currency Revolution",,https://www.reddit.com/r/CryptoCurrency/comments/1dp0bsk/argentinian_president_javier_milei_advocates_for/,0.0,48,2024-06-26 10:44:34,2024-06-28 01:33:39
CryptoCurrency,It was just announced at Decipher 24 that Mastercard and Pera Wallet have partnered to make USDCA spendable with any merchant that accepts MC,I think this announcement is a significant milestone for the widespread adoption of cryptocurrency b,https://www.reddit.com/r/CryptoCurrency/comments/1doyeej/it_was_just_announced_at_decipher_24_that/,0.3176,58,2024-06-26 09:17:35,2024-06-28 01:33:39
CryptoCurrency,Vitalik Buterin backs new Ethereum-compatible chain MegaETH in $20M round,,https://www.reddit.com/r/CryptoCurrency/comments/1dpzeba/vitalik_buterin_backs_new_ethereumcompatible/,-0.0516,0,2024-06-27 15:10:08,2024-06-28 01:33:39
CryptoCurrency,Marathon Digital Holdings Announces Kaspa Mining Operations,,https://www.reddit.com/r/CryptoCurrency/comments/1dp8n64/marathon_digital_holdings_announces_kaspa_mining/,0.0,12,2024-06-26 16:27:34,2024-06-28 01:33:39
CryptoCurrency,Dfinity announces new ICP-powered platform to tackle cybersecurity,,https://www.reddit.com/r/CryptoCurrency/comments/1dpwri2/dfinity_announces_new_icppowered_platform_to/,0.0,0,2024-06-27 13:21:02,2024-06-28 01:33:39
CryptoCurrency,XRP bros….it’s over,https://x.com/nullpackets/status/1805789896466219365?s=46&amp;t=eQizEKvC83HsvHpxkZyOAQ https://www.y,https://www.reddit.com/r/CryptoCurrency/comments/1dop6n5/xrp_brosits_over/,0.9681,254,2024-06-25 23:43:33,2024-06-28 01:33:39
CryptoCurrency,AI Tokens Surge Despite Nvidia’s $430 Billion Market Cap Loss,,https://www.reddit.com/r/CryptoCurrency/comments/1dotl79/ai_tokens_surge_despite_nvidias_430_billion/,-0.3182,98,2024-06-26 04:29:11,2024-06-28 01:33:39
CryptoCurrency,Interview: Algorand launches LiquidAuth to combat WalletConnect vulnerability,,https://www.reddit.com/r/CryptoCurrency/comments/1dozugj/interview_algorand_launches_liquidauth_to_combat/,-0.5106,28,2024-06-26 10:23:26,2024-06-28 01:33:39
CryptoCurrency,Exodus wallet is either compromised or stealing.,"Just a head's up, I've been in this game a while and Exodus forced an update some time back and when",https://www.reddit.com/r/CryptoCurrency/comments/1dp7oc6/exodus_wallet_is_either_compromised_or_stealing/,-0.9442,7,2024-06-26 15:46:48,2024-06-28 01:33:39
CryptoCurrency,Telegram mini-app devs can now earn Toncoin with Adsgram,,https://www.reddit.com/r/CryptoCurrency/comments/1dpoqzq/telegram_miniapp_devs_can_now_earn_toncoin_with/,0.0,0,2024-06-27 07:13:57,2024-06-28 01:33:39
CryptoCurrency,Cardano DDoS attempt ends with attacker losing funds,Yesterday an attack was attempted on the Cardano blockchain. The attacker used reference scripts to ,https://www.reddit.com/r/CryptoCurrency/comments/1dosl26/cardano_ddos_attempt_ends_with_attacker_losing/,-0.99,84,2024-06-26 03:16:05,2024-06-28 01:33:39
CryptoCurrency,Will technical analysis rid crypto trading of speculation?,"Technical analysis in crypto distinguishes profitable trading from speculation what has a big sense,",https://www.reddit.com/r/CryptoCurrency/comments/1dp12kj/will_technical_analysis_rid_crypto_trading_of/,0.9842,17,2024-06-26 11:15:45,2024-06-28 01:33:39
CryptoCurrency,PEPE Holder Loses 3.5M After 700B Binance Splash,,https://www.reddit.com/r/CryptoCurrency/comments/1dp9vfe/pepe_holder_loses_35m_after_700b_binance_splash/,-0.3182,4,2024-06-26 17:18:45,2024-06-28 01:33:39
CryptoCurrency,Is BTC and ETH the only reasonable one’s? And a few other questions,"Hey, I’m very young and very new to this space. I’d be very happy to be answered as if I were 5. So,",https://www.reddit.com/r/CryptoCurrency/comments/1dor8u3/is_btc_and_eth_the_only_reasonable_ones_and_a_few/,0.96,78,2024-06-26 01:46:13,2024-06-28 01:33:39
CryptoCurrency,Looking for advice on lending protocols like AAVE and Compound.,I'm hoping someone can give advice/feedback/thoughts on using a lending protocol as a place to stash,https://www.reddit.com/r/CryptoCurrency/comments/1dpnodw/looking_for_advice_on_lending_protocols_like_aave/,0.9582,0,2024-06-27 06:06:36,2024-06-28 01:33:39
CryptoCurrency,Synternet Mainnet is Now Live with Monaco Launch,,https://www.reddit.com/r/CryptoCurrency/comments/1dpqxfv/synternet_mainnet_is_now_live_with_monaco_launch/,0.0,0,2024-06-27 09:11:02,2024-06-28 01:33:39
CryptoCurrency,Looking to try my luck at music NFTs,"Exactly what the title says. Been trying to make money with music for 20 years, and while streaming ",https://www.reddit.com/r/CryptoCurrency/comments/1dpgjpg/looking_to_try_my_luck_at_music_nfts/,0.8474,0,2024-06-26 22:32:27,2024-06-28 01:33:39
CryptoCurrency,54% of institutional investors in Japan plan to invest in crypto: Survey,,https://www.reddit.com/r/CryptoCurrency/comments/1doxl7c/54_of_institutional_investors_in_japan_plan_to/,0.0,13,2024-06-26 08:38:32,2024-06-28 01:33:39
CryptoCurrency,Nigeria rejects US lawmakers’ report ailing Binance exec isn’t getting care,,https://www.reddit.com/r/CryptoCurrency/comments/1dpfgkl/nigeria_rejects_us_lawmakers_report_ailing/,0.0,1,2024-06-26 21:37:48,2024-06-28 01:33:39
CryptoCurrency,Mt. Gox Redemption Fears ‘Overblown’ Say Traders as $10B BTC Holdings Draw Concerns,,https://www.reddit.com/r/CryptoCurrency/comments/1dopigf/mt_gox_redemption_fears_overblown_say_traders_as/,-0.4215,35,2024-06-26 00:01:19,2024-06-28 01:33:39
CryptoCurrency,Smash Mouth - All Star (Crypto Parody),,https://www.reddit.com/r/CryptoCurrency/comments/1dpc45m/smash_mouth_all_star_crypto_parody/,0.0,0,2024-06-26 18:56:01,2024-06-28 01:33:39
CryptoCurrency,Is Michael Saylor hinting at KASPA?,"[Recently, MARA has announced that they have been mining KASPA and will increase the hash rate in Q3",https://www.reddit.com/r/CryptoCurrency/comments/1dppqhg/is_michael_saylor_hinting_at_kaspa/,-0.6986,0,2024-06-27 08:09:19,2024-06-28 01:33:39
CryptoCurrency,FBI Warns of crypto scammers posing as law firms to help victims of fraud | Invezz,,https://www.reddit.com/r/CryptoCurrency/comments/1dot2hv/fbi_warns_of_crypto_scammers_posing_as_law_firms/,-0.5859,13,2024-06-26 03:51:15,2024-06-28 01:33:39
CryptoCurrency,Coinbase has enabled send and receive support for USDC on Algorand,"As per the official Coinbase Assets X account, they have enabled send and receive support for USDC o",https://www.reddit.com/r/CryptoCurrency/comments/1dodzo0/coinbase_has_enabled_send_and_receive_support_for/,0.7269,131,2024-06-25 15:07:08,2024-06-28 01:33:39
CryptoCurrency,Florida man convicted in cryptocurrency theft home invasions,,https://www.reddit.com/r/CryptoCurrency/comments/1dp4gwd/florida_man_convicted_in_cryptocurrency_theft/,0.0,3,2024-06-26 13:34:15,2024-06-28 01:33:39
CryptoCurrency,'It will soon be confirmed that Ethereum is not a security': Galaxy,,https://www.reddit.com/r/CryptoCurrency/comments/1do5119/it_will_soon_be_confirmed_that_ethereum_is_not_a/,-0.2584,338,2024-06-25 08:40:53,2024-06-28 01:33:39
CryptoCurrency,New Filing Boosts Confidence in July Ethereum ETF Approvals,,https://www.reddit.com/r/CryptoCurrency/comments/1dos6ih/new_filing_boosts_confidence_in_july_ethereum_etf/,0.6808,7,2024-06-26 02:48:57,2024-06-28 01:33:39
CryptoCurrency,SEC chair Gensler criticizes crypto sector for non-compliance and 'high centralization',,https://www.reddit.com/r/CryptoCurrency/comments/1dolvjk/sec_chair_gensler_criticizes_crypto_sector_for/,-0.34,19,2024-06-25 20:53:34,2024-06-28 01:33:39
CryptoCurrency,Still the best explanation I've seen,,https://www.reddit.com/r/CryptoCurrency/comments/1do3vd4/still_the_best_explanation_ive_seen/,0.6369,245,2024-06-25 07:37:44,2024-06-28 01:33:39
CryptoCurrency,"Daily Crypto Discussion - June 26, 2024 (GMT+0)",**Welcome to the Daily Crypto Discussion thread. Please read the disclaimer and rules before partici,https://www.reddit.com/r/CryptoCurrency/comments/1doksdb/daily_crypto_discussion_june_26_2024_gmt0/,0.9539,25,2024-06-25 20:00:27,2024-06-28 01:33:39
CryptoCurrency,To those that doubt that scarcity alone is enough to give this tech VALUE,Scarcity doesn’t sound like “enough” to make value to a lot of people. But what people don’t get is ,https://www.reddit.com/r/CryptoCurrency/comments/1dpkfry/to_those_that_doubt_that_scarcity_alone_is_enough/,0.9301,0,2024-06-27 02:18:15,2024-06-28 01:33:39
CryptoCurrency,"German gov’t offloads 900 Bitcoin, with 400 BTC sent to Coinbase and Kraken",,https://www.reddit.com/r/CryptoCurrency/comments/1do2yq9/german_govt_offloads_900_bitcoin_with_400_btc/,0.0,256,2024-06-25 06:42:51,2024-06-28 01:33:39
CryptoCurrency,"Crypto Fear and Greed Index hits 30, lowest level in 18 months",,https://www.reddit.com/r/CryptoCurrency/comments/1do538g/crypto_fear_and_greed_index_hits_30_lowest_level/,-0.8176,148,2024-06-25 08:43:53,2024-06-28 01:33:39
CryptoCurrency,German Government's Large-Scale Bitcoin Transactions Impact Crypto Market,,https://www.reddit.com/r/CryptoCurrency/comments/1dp0xb5/german_governments_largescale_bitcoin/,0.0,1,2024-06-26 11:09:53,2024-06-28 01:33:39
CryptoCurrency,FTX customers to vote on bankruptcy repayment plan,,https://www.reddit.com/r/CryptoCurrency/comments/1dojesv/ftx_customers_to_vote_on_bankruptcy_repayment_plan/,0.0,14,2024-06-25 18:57:02,2024-06-28 01:33:39
CryptoCurrency,TRON Overthrows SHIB as Justin Sun Makes Use of Ethereum Dip,,https://www.reddit.com/r/CryptoCurrency/comments/1dp9woi/tron_overthrows_shib_as_justin_sun_makes_use_of/,0.0,0,2024-06-26 17:20:11,2024-06-28 01:33:39
CryptoCurrency,Friend getting that Mt Gox payment,Thought I’d say this since it’s wild to know someone irl who has this happening to them. He had a lo,https://www.reddit.com/r/CryptoCurrency/comments/1dnwvcx/friend_getting_that_mt_gox_payment/,0.8337,367,2024-06-24 23:54:38,2024-06-28 01:33:39
CryptoCurrency,FTX Claims Value Soar,,https://www.reddit.com/r/CryptoCurrency/comments/1dp3i33/ftx_claims_value_soar/,0.34,0,2024-06-26 12:54:03,2024-06-28 01:33:39
CryptoCurrency,The Tezos Community Celebrates First Week of Adaptive Issuance and New 'Staker' Role on Mainnet,"On June 19th, the Tezos community took a significant step forward with the activation of Adaptive Is",https://www.reddit.com/r/CryptoCurrency/comments/1dovba6/the_tezos_community_celebrates_first_week_of/,0.9324,2,2024-06-26 06:28:46,2024-06-28 01:33:39
CryptoCurrency,"Marc Cuban wallet dumps NFTs, market volume drops 45%: Nifty Newsletter",,https://www.reddit.com/r/CryptoCurrency/comments/1dp71uv/marc_cuban_wallet_dumps_nfts_market_volume_drops/,0.0,0,2024-06-26 15:21:11,2024-06-28 01:33:39
CryptoCurrency,Negative Trend in US Spot Bitcoin Exchange Traded Funds (ETFs) Ended! How Many Entries Have Been Seen? Here are the Details,,https://www.reddit.com/r/CryptoCurrency/comments/1dp0em7/negative_trend_in_us_spot_bitcoin_exchange_traded/,-0.6114,0,2024-06-26 10:47:47,2024-06-28 01:33:39
CryptoCurrency,FBI Warns of Fake Firms Promising to Recover Lost Cryptocurrencies,,https://www.reddit.com/r/CryptoCurrency/comments/1do4xpn/fbi_warns_of_fake_firms_promising_to_recover_lost/,-0.4767,37,2024-06-25 08:36:12,2024-06-28 01:33:39
CryptoCurrency,"Argentine President Embraces Bitcoin, Sparking Digital Currency Revolution",,https://www.reddit.com/r/CryptoCurrency/comments/1dp1x90/argentine_president_embraces_bitcoin_sparking/,0.0,0,2024-06-26 11:50:27,2024-06-28 01:33:39
CryptoCurrency,Market cap to volume ratio and understanding question,If the coin market cap and volume is almost 1:1 is that a sign that the coin is undervalued? Just wo,https://www.reddit.com/r/CryptoCurrency/comments/1dp1o8u/market_cap_to_volume_ratio_and_understanding/,0.9502,0,2024-06-26 11:40:10,2024-06-28 01:33:39
CryptoCurrency,Linux Foundation Announces Intent to Form LF Decentralized Trust,,https://www.reddit.com/r/CryptoCurrency/comments/1doaw51/linux_foundation_announces_intent_to_form_lf/,0.5106,15,2024-06-25 12:58:25,2024-06-28 01:33:39
CryptoCurrency,VanEck files Form 8-A as path towards a spot Ethereum ETF presses on,,https://www.reddit.com/r/CryptoCurrency/comments/1do7dyx/vaneck_files_form_8a_as_path_towards_a_spot/,0.0,20,2024-06-25 10:29:57,2024-06-28 01:33:39
CryptoCurrency,Why Bitcoin Matters — The Real Value Of BTC Beyond Its Volatility,,https://www.reddit.com/r/CryptoCurrency/comments/1dovzc5/why_bitcoin_matters_the_real_value_of_btc_beyond/,0.3612,0,2024-06-26 07:10:16,2024-06-28 01:33:39
CryptoCurrency,Has Solana gotten stronger during the bear market?,As we have broken out of the bear market I do realize that Solana has done a lot of work with their ,https://www.reddit.com/r/CryptoCurrency/comments/1dp7kfw/has_solana_gotten_stronger_during_the_bear_market/,0.8645,0,2024-06-26 15:42:32,2024-06-28 01:33:39
