"subreddit","title","selftext","url","sentiment","upvotes","created_at"
CryptoCurrency,"Bitcoin Volatility Index Rises To 52.7, Up By 4.42%",,https://www.reddit.com/r/CryptoCurrency/comments/1dod8np/bitcoin_volatility_index_rises_to_527_up_by_442/,0.0,4,2024-06-25 14:36:31,2024-06-28 01:33:39
CryptoCurrency,Here's why I'm selling all my bags and no longer believe. This game is rigged.,I'm selling all my bags of fiat toilet paper. I'm done with them. It's a rigged system. https://prev,https://www.reddit.com/r/CryptoCurrency/comments/1dnimgj/heres_why_im_selling_all_my_bags_and_no_longer/,-0.4265,385,2024-06-24 13:05:33,2024-06-28 01:33:39
CryptoCurrency,Bitcoin spot ETFs could hit longest outflow streak on record,,https://www.reddit.com/r/CryptoCurrency/comments/1do1tjr/bitcoin_spot_etfs_could_hit_longest_outflow/,0.0,15,2024-06-25 05:25:07,2024-06-28 01:33:39
CryptoCurrency,Solana introduces ‘ZK Compression’ aimed at reducing on-chain storage costs by 99%,,https://www.reddit.com/r/CryptoCurrency/comments/1do3kqo/solana_introduces_zk_compression_aimed_at/,0.0,9,2024-06-25 07:20:28,2024-06-28 01:33:39
CryptoCurrency,Ethereum Faces Longest Inflationary Period Since 2022 Merge,,https://www.reddit.com/r/CryptoCurrency/comments/1dowj33/ethereum_faces_longest_inflationary_period_since/,0.0,0,2024-06-26 07:41:53,2024-06-28 01:33:39
CryptoCurrency,Bitcoin's June Crash: How Miner Sell-Offs Triggered a Market Meltdown,,https://www.reddit.com/r/CryptoCurrency/comments/1dnhkgy/bitcoins_june_crash_how_miner_selloffs_triggered/,-0.4019,302,2024-06-24 12:22:28,2024-06-28 01:33:39
CryptoMarkets,"Weekly Discussion Megathread - June 23, 2024 (GMT+0)",Welcome to the r/CryptoMarkets Weekly Discussion thread. The thread guidelines are as follows: *** T,https://www.reddit.com/r/CryptoMarkets/comments/1dmlm3g/weekly_discussion_megathread_june_23_2024_gmt0/,0.9684,3,2024-06-23 09:00:16,2024-06-28 01:33:39
CryptoMarkets,"Scaramucci Backs Biden, Warning Against Trump’s Crypto Policy",,https://www.reddit.com/r/CryptoMarkets/comments/1dpz4l4/scaramucci_backs_biden_warning_against_trumps/,-0.3818,14,2024-06-27 14:59:01,2024-06-28 01:33:39
CryptoMarkets,Whats the best TA method in your opinions?,"I know it varies depending on the price moment, market, and individual risk management. But for you,",https://www.reddit.com/r/CryptoMarkets/comments/1dpybc6/whats_the_best_ta_method_in_your_opinions/,0.7615,6,2024-06-27 14:25:16,2024-06-28 01:33:39
CryptoMarkets,"LP and Trading opportunity to make 70,000 ARB","Sushi Swap, Steer Protocol and SX all received Long Term Incentive Pilot Program (LTIPP) grants from",https://www.reddit.com/r/CryptoMarkets/comments/1dput5c/lp_and_trading_opportunity_to_make_70000_arb/,0.9413,9,2024-06-27 12:00:41,2024-06-28 01:33:39
CryptoMarkets,How do you do it?,How? How do people get out of their own way? How do people sit and watch their money go away without,https://www.reddit.com/r/CryptoMarkets/comments/1dpo182/how_do_you_do_it/,-0.7382,20,2024-06-27 06:30:06,2024-06-28 01:33:39
CryptoMarkets,Kraken Turns Its First Hack Into White Hat Firm’s PR Nightmare,The security team of Kraken knew that someday an attacker would penetrate their cyber defenses. On J,https://www.reddit.com/r/CryptoMarkets/comments/1dpry63/kraken_turns_its_first_hack_into_white_hat_firms/,0.1706,9,2024-06-27 09:58:37,2024-06-28 01:33:39
CryptoMarkets,DeFi’s UX Is Becoming A Deterrent To Adoption – Is AI The Antidote?,,https://www.reddit.com/r/CryptoMarkets/comments/1dpt4hd/defis_ux_is_becoming_a_deterrent_to_adoption_is/,0.0,17,2024-06-27 10:50:03,2024-06-28 01:33:39
CryptoMarkets,US Government Moves $240 Million in Bitcoin to Coinbase,,https://www.reddit.com/r/CryptoMarkets/comments/1dplx3z/us_government_moves_240_million_in_bitcoin_to/,0.0,19,2024-06-27 04:01:15,2024-06-28 01:33:39
CryptoMarkets,SOLANA ETF FILED BY VANECK!!!!!!!,"VanEck, a major crypto asset management firm, has filed for a spot Solana ETF with the U.S. Securiti",https://www.reddit.com/r/CryptoMarkets/comments/1dpqyqb/solana_etf_filed_by_vaneck/,0.7308,6,2024-06-27 09:12:48,2024-06-28 01:33:39
CryptoMarkets,What is going on with Blast/Blur?,I was on the expectation that there would be an integration between these projects given that both o,https://www.reddit.com/r/CryptoMarkets/comments/1dpxqmi/what_is_going_on_with_blastblur/,0.6608,2,2024-06-27 14:01:13,2024-06-28 01:33:39
CryptoMarkets,Coinbase sues SEC and FDIC for crypto regulatory clarity,,https://www.reddit.com/r/CryptoMarkets/comments/1dpqxqk/coinbase_sues_sec_and_fdic_for_crypto_regulatory/,0.4019,5,2024-06-27 09:11:25,2024-06-28 01:33:39
CryptoMarkets,Thank you,"I made a post, pretty worried after buying at a high price on Solana. 20K at $148 and some at smalle",https://www.reddit.com/r/CryptoMarkets/comments/1dpw503/thank_you/,0.9259,2,2024-06-27 12:55:30,2024-06-28 01:33:39
CryptoMarkets,"Faced With the Demagoguery of Politicians Everywhere in the World, Bitcoin Is Your Best Bulwark. More than ever, the world needs a monetary system with decentralized, rigorous and serious governance, free from the risk of manipulation and scheming.",,https://www.reddit.com/r/CryptoMarkets/comments/1dq063s/faced_with_the_demagoguery_of_politicians/,0.4215,1,2024-06-27 15:42:51,2024-06-28 01:33:39
CryptoMarkets,Kraken Turns Its First Hack Into White Hat Firm’s PR Nightmare,[Kraken Turns Its First Hack Into White Hat Firm’s PR Nightmare](https://www.disruptionbanking.com/2,https://www.reddit.com/r/CryptoMarkets/comments/1dpqoz4/kraken_turns_its_first_hack_into_white_hat_firms/,-0.128,3,2024-06-27 08:59:46,2024-06-28 01:33:39
CryptoMarkets,Cant do future transaction,I cant do future transaction in binance from today. I asked live support and he said that with the n,https://www.reddit.com/r/CryptoMarkets/comments/1dprhgu/cant_do_future_transaction/,0.7684,2,2024-06-27 09:37:14,2024-06-28 01:33:39
CryptoMarkets,Historic Satoshi-Era Bitcoin Wallet Awakens After 14 Years,,https://www.reddit.com/r/CryptoMarkets/comments/1dpqukm/historic_satoshiera_bitcoin_wallet_awakens_after/,0.0,2,2024-06-27 09:07:11,2024-06-28 01:33:39
CryptoMarkets,Binance Tightens Measures to Combat Account Misuse,,https://www.reddit.com/r/CryptoMarkets/comments/1dpqj3z/binance_tightens_measures_to_combat_account_misuse/,-0.34,2,2024-06-27 08:51:28,2024-06-28 01:33:39
CryptoMarkets,North Carolina Passes Bill Restricting CBDC Usage,,https://www.reddit.com/r/CryptoMarkets/comments/1dpmlkt/north_carolina_passes_bill_restricting_cbdc_usage/,-0.3818,4,2024-06-27 04:51:07,2024-06-28 01:33:39
CryptoMarkets,CHZ Crypto to move up: CHZ crypto price prediction,,https://www.reddit.com/r/CryptoMarkets/comments/1dpq1w3/chz_crypto_to_move_up_chz_crypto_price_prediction/,0.0,2,2024-06-27 08:26:13,2024-06-28 01:33:39
CryptoMarkets,Bought a new memecoin on Dexscreener Moonlight,"I bought a new memecoin just now, Y U NO-GUY. It’s on Solana and have low fees. Bought it on Moonlig",https://www.reddit.com/r/CryptoMarkets/comments/1dpq1kd/bought_a_new_memecoin_on_dexscreener_moonlight/,0.9741,2,2024-06-27 08:25:44,2024-06-28 01:33:39
CryptoMarkets,Coinbase opts out of ASI token merger migration,,https://www.reddit.com/r/CryptoMarkets/comments/1dpmanm/coinbase_opts_out_of_asi_token_merger_migration/,0.0,5,2024-06-27 04:29:07,2024-06-28 01:33:39
CryptoMarkets,"SocialFi Infrastructure OpenSocial Protocol Raises $5M to Fuel the Growth of SocialFi Super Apps, with $15M Ecosystem Fund Backed by EVG",,https://www.reddit.com/r/CryptoMarkets/comments/1dpkwvi/socialfi_infrastructure_opensocial_protocol/,0.765,6,2024-06-27 02:49:53,2024-06-28 01:33:39
CryptoMarkets,"VanEck files for the first Solana ETF in the US, calls SOL a commodity",,https://www.reddit.com/r/CryptoMarkets/comments/1dprxhw/vaneck_files_for_the_first_solana_etf_in_the_us/,0.0,1,2024-06-27 09:57:49,2024-06-28 01:33:39
CryptoMarkets,Coinbase Sues SEC and FDIC for FOIA Noncompliance,,https://www.reddit.com/r/CryptoMarkets/comments/1dprssg/coinbase_sues_sec_and_fdic_for_foia_noncompliance/,0.0,1,2024-06-27 09:51:46,2024-06-28 01:33:39
CryptoMarkets,"Bitcoin whale donates 8 BTC to Julian Assange, covers private jet costs",,https://www.reddit.com/r/CryptoMarkets/comments/1dp79uk/bitcoin_whale_donates_8_btc_to_julian_assange/,0.0,30,2024-06-26 15:30:33,2024-06-28 01:33:39
CryptoMarkets,VanEck Files for Spot Solana ETF: A Game-Changer for the Crypto Market,,https://www.reddit.com/r/CryptoMarkets/comments/1dprnuv/vaneck_files_for_spot_solana_etf_a_gamechanger/,0.0,1,2024-06-27 09:45:27,2024-06-28 01:33:39
CryptoMarkets,Ether Spot ETFs Poised to Attract $5 Billion in First Five Months: Galaxy,Galaxy expects $5 FREAKING BILLION DOLLARS in first FIVE MONTHS if ETH ETF is approved. Do you think,https://www.reddit.com/r/CryptoMarkets/comments/1dpqgcm/ether_spot_etfs_poised_to_attract_5_billion_in/,0.1943,1,2024-06-27 08:47:26,2024-06-28 01:33:39
CryptoMarkets,Florida Man Convicted in Shocking Crypto Theft Home Invasions,,https://www.reddit.com/r/CryptoMarkets/comments/1dpmcpx/florida_man_convicted_in_shocking_crypto_theft/,-0.4019,2,2024-06-27 04:33:01,2024-06-28 01:33:39
CryptoMarkets,"UAE’s New Regulations Threaten Crypto Payments, Warns Legal Expert",,https://www.reddit.com/r/CryptoMarkets/comments/1dpo8ie/uaes_new_regulations_threaten_crypto_payments/,-0.3612,1,2024-06-27 06:43:15,2024-06-28 01:33:39
CryptoMarkets,'Advantages of Using Solana Token Launcher?',What are the key advantages of using a Solana token launcher for creating and managing your own cryp,https://www.reddit.com/r/CryptoMarkets/comments/1dpnuig/advantages_of_using_solana_token_launcher/,0.7622,1,2024-06-27 06:17:57,2024-06-28 01:33:39
CryptoMarkets,"US government transfers 4,000 BTC to Coinbase",,https://www.reddit.com/r/CryptoMarkets/comments/1dp5v2w/us_government_transfers_4000_btc_to_coinbase/,0.0,17,2024-06-26 14:32:17,2024-06-28 01:33:39
CryptoMarkets,Crypto Investment Firm Hashed Ventures to Open Office in Abu Dhabi,,https://www.reddit.com/r/CryptoMarkets/comments/1dpmvrx/crypto_investment_firm_hashed_ventures_to_open/,0.0,1,2024-06-27 05:11:13,2024-06-28 01:33:39
CryptoMarkets,BTC ETH SOL - The combo meal everyone wants,If you had these three coins in your portfolio then they have certainly changed how your portfolio l,https://www.reddit.com/r/CryptoMarkets/comments/1dpdgdp/btc_eth_sol_the_combo_meal_everyone_wants/,0.5106,3,2024-06-26 19:58:27,2024-06-28 01:33:39
CryptoMarkets,Anyone used a bot through Simon McFadyen?,I see this guy on YouTube ads all the time and just wondered if anyone has any experience dealing wi,https://www.reddit.com/r/CryptoMarkets/comments/1dpkxla/anyone_used_a_bot_through_simon_mcfadyen/,0.0,0,2024-06-27 02:51:12,2024-06-28 01:33:39
CryptoMarkets,PEPE Holder Loses 3.5M After 700B Binance Splash,,https://www.reddit.com/r/CryptoMarkets/comments/1dp9vmj/pepe_holder_loses_35m_after_700b_binance_splash/,-0.3182,5,2024-06-26 17:18:58,2024-06-28 01:33:39
CryptoMarkets,"U.S. Government Sends Nearly 4,000 Bitcoin to Coinbase Exchange",,https://www.reddit.com/r/CryptoMarkets/comments/1dpk5y3/us_government_sends_nearly_4000_bitcoin_to/,0.0,1,2024-06-27 02:00:17,2024-06-28 01:33:39
CryptoMarkets,Is The Future of Real Estate Web3-Based,,https://www.reddit.com/r/CryptoMarkets/comments/1dp14hg/is_the_future_of_real_estate_web3based/,0.0,30,2024-06-26 11:17:58,2024-06-28 01:33:39
CryptoMarkets,How to Buy DEXT Token: A Beginner’s Guide,,https://www.reddit.com/r/CryptoMarkets/comments/1dpie24/how_to_buy_dext_token_a_beginners_guide/,0.0,0,2024-06-27 00:11:43,2024-06-28 01:33:39
CryptoMarkets,CPI and jobs data in July will finalize the trend,"I think the markets are waiting for the numbers that will be coming out in July, I think they will b",https://www.reddit.com/r/CryptoMarkets/comments/1dp6zhv/cpi_and_jobs_data_in_july_will_finalize_the_trend/,0.0258,5,2024-06-26 15:18:37,2024-06-28 01:33:39
CryptoMarkets,TRON Overthrows SHIB as Justin Sun Makes Use of Ethereum Dip,,https://www.reddit.com/r/CryptoMarkets/comments/1dp9wgg/tron_overthrows_shib_as_justin_sun_makes_use_of/,0.0,2,2024-06-26 17:19:57,2024-06-28 01:33:39
CryptoMarkets,the DoughFinance founders turned this strategy into a new DeFi protocol/platform,,https://www.reddit.com/r/CryptoMarkets/comments/1dpcy5y/the_doughfinance_founders_turned_this_strategy/,0.0,1,2024-06-26 19:33:52,2024-06-28 01:33:39
CryptoMarkets,"FET, OCEAN and AGIX pump prior to ASI merge.","Top 3 AI projects gained some momentum as the big day approaches. Ocean Protocol, Fetch.ai and Singu",https://www.reddit.com/r/CryptoMarkets/comments/1dp27rt/fet_ocean_and_agix_pump_prior_to_asi_merge/,0.9868,4,2024-06-26 12:01:46,2024-06-28 01:33:39
CryptoMarkets,Can anyone tell me if this is legit or a scam,"Hello, is TRJCW a legit website? Never heard of it and i can't find much on the Internet. Your help ",https://www.reddit.com/r/CryptoMarkets/comments/1dpa1e3/can_anyone_tell_me_if_this_is_legit_or_a_scam/,0.5859,0,2024-06-26 17:25:46,2024-06-28 01:33:39
CryptoMarkets,"B2Trader v1.1 Update: BBP Prime, Custom Templates, and iOS Integration",,https://www.reddit.com/r/CryptoMarkets/comments/1dp45s6/b2trader_v11_update_bbp_prime_custom_templates/,0.0,2,2024-06-26 13:21:13,2024-06-28 01:33:39
CryptoMarkets,Principled diversified investment?,"Say I want to invest into crypto in a somewhat principled manner, as I do into the stock market. For",https://www.reddit.com/r/CryptoMarkets/comments/1dp8e5t/principled_diversified_investment/,-0.9611,1,2024-06-26 16:16:54,2024-06-28 01:33:39
CryptoMarkets,Metallica’s X Account Hacked to Promote Fake Crypto Token,,https://www.reddit.com/r/CryptoMarkets/comments/1dovprz/metallicas_x_account_hacked_to_promote_fake/,-0.4939,6,2024-06-26 06:54:36,2024-06-28 01:33:39
CryptoMarkets,How Cryptocurrencies can transforming charitable giving,,https://www.reddit.com/r/CryptoMarkets/comments/1dov4uj/how_cryptocurrencies_can_transforming_charitable/,0.6249,5,2024-06-26 06:17:16,2024-06-28 01:33:39
CryptoMarkets,Cardano undefeated by DdoS attack,"Cardano Hit With Massive DDoS Attack Yet Thriving, Here's Reason https://cryptonews.net/29309241/?ut",https://www.reddit.com/r/CryptoMarkets/comments/1dors5x/cardano_undefeated_by_ddos_attack/,-0.7351,10,2024-06-26 02:22:07,2024-06-28 01:33:39
CryptoMarkets,Who to Watch in the Next-Gen VM Race?,I stumbled upon a tweet by (@ayyyeandy) that got me really excited about the future of blockchain vi,https://www.reddit.com/r/CryptoMarkets/comments/1dozu8v/who_to_watch_in_the_nextgen_vm_race/,0.9785,2,2024-06-26 10:23:10,2024-06-28 01:33:39
CryptoMarkets,Bitcoin Price Prediction: Analysts Forecast BTC to Drop to $50K Before Parabolic Surge,[Bitcoin's](https://www.nanovest.io/kripto/btc/) price is predicted to undergo a significant decline,https://www.reddit.com/r/CryptoMarkets/comments/1doqihh/bitcoin_price_prediction_analysts_forecast_btc_to/,0.9837,9,2024-06-26 01:00:30,2024-06-28 01:33:39
CryptoMarkets,Spot Ethereum ETF to attract $15 billion by 2025's end: Bitwise CIO,,https://www.reddit.com/r/CryptoMarkets/comments/1doyqhj/spot_ethereum_etf_to_attract_15_billion_by_2025s/,0.3612,2,2024-06-26 09:33:28,2024-06-28 01:33:39
CryptoMarkets,Are communities that roleplay bearish or bullish?,"Stumbled across a solana coin community called $Ceezur the other day and when I joined, I was met wi",https://www.reddit.com/r/CryptoMarkets/comments/1dp2y5d/are_communities_that_roleplay_bearish_or_bullish/,0.9447,1,2024-06-26 12:31:01,2024-06-28 01:33:39
CryptoMarkets,The New BEST Way to Buy Monero Without KYC Using P2P Crypto Exchange,,https://www.reddit.com/r/CryptoMarkets/comments/1dp57hp/the_new_best_way_to_buy_monero_without_kyc_using/,0.7125,0,2024-06-26 14:04:46,2024-06-28 01:33:39
CryptoMarkets,Mobile Wallets,What mobile crypto Wallets are you guys using? I am looking for a good wallet other then MetaMask or,https://www.reddit.com/r/CryptoMarkets/comments/1doz6kl/mobile_wallets/,0.8271,1,2024-06-26 09:54:12,2024-06-28 01:33:39
CryptoMarkets,Ethereum ETF Fee War Heats Up As VanEck Offers Zero Fees - TheDailySats,"The battle for dominance in the Ethereum exchange-traded fund (ETF) market is heating up, with inves",https://www.reddit.com/r/CryptoMarkets/comments/1dooimo/ethereum_etf_fee_war_heats_up_as_vaneck_offers/,-0.6597,5,2024-06-25 23:07:38,2024-06-28 01:33:39
CryptoMarkets,Why Bitcoin Matters — The Real Value Of BTC Beyond Its Volatility,,https://www.reddit.com/r/CryptoMarkets/comments/1dow04j/why_bitcoin_matters_the_real_value_of_btc_beyond/,0.3612,0,2024-06-26 07:11:31,2024-06-28 01:33:39
CryptoMarkets,The Tezos Community Celebrates First Week of Adaptive Issuance and New 'Staker' Role on Mainnet,"On June 19th, the Tezos community took a significant step forward with the activation of Adaptive Is",https://www.reddit.com/r/CryptoMarkets/comments/1dovd8t/the_tezos_community_celebrates_first_week_of/,0.9324,1,2024-06-26 06:32:05,2024-06-28 01:33:39
CryptoMarkets,Jump Crypto President Resigns Amid CFTC Investigation,,https://www.reddit.com/r/CryptoMarkets/comments/1douhk7/jump_crypto_president_resigns_amid_cftc/,-0.3182,0,2024-06-26 05:32:46,2024-06-28 01:33:39
CryptoMarkets,BREAKING Spot Bitcoin ETFs Bounce Back with Fresh Inflows of $31 Million!,"Bitcoin spot exchange-traded funds (ETFs) saw a resurgence in inflows on June 25, recording a total ",https://www.reddit.com/r/CryptoMarkets/comments/1dor6kf/breaking_spot_bitcoin_etfs_bounce_back_with_fresh/,0.8392,2,2024-06-26 01:42:20,2024-06-28 01:33:39
CryptoMarkets,From Hype to Quality - A Look at How the Web3 Gaming Landscape Has Matured Recently,,https://www.reddit.com/r/CryptoMarkets/comments/1do9fiy/from_hype_to_quality_a_look_at_how_the_web3/,0.0,36,2024-06-25 11:56:51,2024-06-28 01:33:39
CryptoMarkets,"German Government Offloads Over $54M Worth of Bitcoin, Sell-off Stirs Market Panic",,https://www.reddit.com/r/CryptoMarkets/comments/1dorhf5/german_government_offloads_over_54m_worth_of/,-0.34,0,2024-06-26 02:01:50,2024-06-28 01:33:39
CryptoMarkets,"'Gensler will cause Biden to lose the election,” says Ripple Labs CEO",,https://www.reddit.com/r/CryptoMarkets/comments/1dozxww/gensler_will_cause_biden_to_lose_the_election/,-0.4019,0,2024-06-26 10:27:39,2024-06-28 01:33:39
CryptoMarkets,Terra Luna Classic Loses BtcTurk Listing After Disastrous Hack,,https://www.reddit.com/r/CryptoMarkets/comments/1doabod/terra_luna_classic_loses_btcturk_listing_after/,-0.7351,8,2024-06-25 12:34:05,2024-06-28 01:33:39
CryptoMarkets,How long will you hold your Bitcoin for?,Just curios what the consensus will be! [View Poll](https://www.reddit.com/poll/1do96hk),https://www.reddit.com/r/CryptoMarkets/comments/1do96hk/how_long_will_you_hold_your_bitcoin_for/,0.0,4,2024-06-25 11:46:19,2024-06-28 01:33:39
CryptoMarkets,Crypto Fear and Greed Index Enters 'Fear' Zone,"Key Takeaways * The Crypto Fear and Greed Index dropped to a 9-month low of 30 points on June 25, en",https://www.reddit.com/r/CryptoMarkets/comments/1do2osf/crypto_fear_and_greed_index_enters_fear_zone/,-0.9536,9,2024-06-25 06:24:26,2024-06-28 01:33:39
CryptoMarkets,BTC fear index at 30 but BTC still strong,"Looking at past 1 year data, Bitcoin is still outperforming major stocks (except NVIDIA) and indexes",https://www.reddit.com/r/CryptoMarkets/comments/1do7jal/btc_fear_index_at_30_but_btc_still_strong/,0.9791,1,2024-06-25 10:36:06,2024-06-28 01:33:39
CryptoMarkets,Breakout in JTO Crypto: Buy Now ?,,https://www.reddit.com/r/CryptoMarkets/comments/1dod445/breakout_in_jto_crypto_buy_now/,0.0,1,2024-06-25 14:31:13,2024-06-28 01:33:39
CryptoMarkets,"Bitcoin Poised to Surge Towards $90,000+ with Bullish Indicators",[Bitcoin](https://www.nanovest.io/kripto/btc/) is gearing up to resume its price surge towards targe,https://www.reddit.com/r/CryptoMarkets/comments/1dnxh6f/bitcoin_poised_to_surge_towards_90000_with/,0.9872,12,2024-06-25 00:29:15,2024-06-28 01:33:39
CryptoMarkets,German Government Sells $54M in Bitcoin,,https://www.reddit.com/r/CryptoMarkets/comments/1do4n6y/german_government_sells_54m_in_bitcoin/,0.0,3,2024-06-25 08:21:08,2024-06-28 01:33:39
CryptoMarkets,Crypto contract trading,"Hi guys, Can someone please suggest me which exchange I can use as a resident of Florida,USA for cry",https://www.reddit.com/r/CryptoMarkets/comments/1do6z75/crypto_contract_trading/,0.3182,2,2024-06-25 10:11:56,2024-06-28 01:33:39
CryptoMarkets,Relatively low-risk strategies for trading with a moderate (~$45-$50k) of BTC/ETH?,Relatively low-risk trading strategies with a moderate sum (~$50k) of crypto? As the title indicates,https://www.reddit.com/r/CryptoMarkets/comments/1dobcjk/relatively_lowrisk_strategies_for_trading_with_a/,0.9831,1,2024-06-25 13:17:07,2024-06-28 01:33:39
CryptoMarkets,Coinbase Leads as Most Impersonated Brand by Scammers,,https://www.reddit.com/r/CryptoMarkets/comments/1dnyz6u/coinbase_leads_as_most_impersonated_brand_by/,0.0,5,2024-06-25 02:03:55,2024-06-28 01:33:39
CryptoMarkets,"Louisiana Bans CBDC, Passes BTC Custody Protection Bill",,https://www.reddit.com/r/CryptoMarkets/comments/1do0bbc/louisiana_bans_cbdc_passes_btc_custody_protection/,0.0,4,2024-06-25 03:36:48,2024-06-28 01:33:39
CryptoMarkets,Fear and Greed: 30. The End?,"The fear and greed index is at 30, indicating that the overall market sentiment is Fear. This is evi",https://www.reddit.com/r/CryptoMarkets/comments/1do77ms/fear_and_greed_30_the_end/,-0.9649,1,2024-06-25 10:22:20,2024-06-28 01:33:39
CryptoMarkets,Atlas Earth,Your friend has invited you to buy virtual real estate in ATLAS: EARTH! Get started for free using h,https://www.reddit.com/r/CryptoMarkets/comments/1do6q5h/atlas_earth/,0.7777,0,2024-06-25 10:01:01,2024-06-28 01:33:39
CryptoMarkets,Effortless Swaps with Rango dApp Integrated into Safe Wallet,,https://www.reddit.com/r/CryptoMarkets/comments/1do2hg9/effortless_swaps_with_rango_dapp_integrated_into/,0.4404,2,2024-06-25 06:10:33,2024-06-28 01:33:39
CryptoMarkets,"AI tokens FET, AGIX, OCEAN, and ARKM surge despite market sell-off",,https://www.reddit.com/r/CryptoMarkets/comments/1do6et4/ai_tokens_fet_agix_ocean_and_arkm_surge_despite/,0.0,1,2024-06-25 09:46:49,2024-06-28 01:33:39
CryptoMarkets,"L1 and L2's, What are they?",# Background: Bitcoin and Ethereum are considered the OG cryptocurrencies. These are the base layers,https://www.reddit.com/r/CryptoMarkets/comments/1dnutje/l1_and_l2s_what_are_they/,0.9937,6,2024-06-24 22:04:25,2024-06-28 01:33:39
CryptoMarkets,Biden Brings Back Former Pro-crypto Regulation Advisor - Bitcoinics,,https://www.reddit.com/r/CryptoMarkets/comments/1dnowpz/biden_brings_back_former_procrypto_regulation/,0.0,9,2024-06-24 17:27:22,2024-06-28 01:33:39
CryptoMarkets,"Token merger of Fetch.ai, SingularityNET, and Ocean Protocol to start on July 1",,https://www.reddit.com/r/CryptoMarkets/comments/1do2n5y/token_merger_of_fetchai_singularitynet_and_ocean/,0.0,1,2024-06-25 06:21:13,2024-06-28 01:33:39
CryptoMarkets,Do you think the whales buying BTC this week and in July can help increase the price and improve the overall market sentiment?,"I do think when/if the whales continue to buy BTC, more investors are driven to it and the market se",https://www.reddit.com/r/CryptoMarkets/comments/1dob4gr/do_you_think_the_whales_buying_btc_this_week_and/,0.9531,0,2024-06-25 13:07:47,2024-06-28 01:33:39
CryptoMarkets,Iranian Leaders Slam ‘Hamster Kombat’ Game as Western Manipulation,,https://www.reddit.com/r/CryptoMarkets/comments/1do1ymi/iranian_leaders_slam_hamster_kombat_game_as/,-0.5859,1,2024-06-25 05:35:10,2024-06-28 01:33:39
CryptoMarkets,Bitcoin spot ETFs could hit longest outflow streak on record,,https://www.reddit.com/r/CryptoMarkets/comments/1do1tpl/bitcoin_spot_etfs_could_hit_longest_outflow/,0.0,0,2024-06-25 05:25:25,2024-06-28 01:33:39
CryptoMarkets,Bitcoin Price Influenced by 3 Key Liquidity Factors: What's Driving the Market?,,https://www.reddit.com/r/CryptoMarkets/comments/1do0th7/bitcoin_price_influenced_by_3_key_liquidity/,0.0,1,2024-06-25 04:13:19,2024-06-28 01:33:39
CryptoMarkets,Nvidia’s Dominance in AI Race,,https://www.reddit.com/r/CryptoMarkets/comments/1do0dek/nvidias_dominance_in_ai_race/,0.2023,1,2024-06-25 03:41:08,2024-06-28 01:33:39
CryptoMarkets,Do RWAs Hold The Key to Unlocking Fractional Ownership at Scale?,,https://www.reddit.com/r/CryptoMarkets/comments/1dng5q9/do_rwas_hold_the_key_to_unlocking_fractional/,0.0,34,2024-06-24 11:24:31,2024-06-28 01:33:39
CryptoMarkets,"German government entity transfers 900 BTC to Kraken and Coinbase, sparks selling concerns",,https://www.reddit.com/r/CryptoMarkets/comments/1do55vk/german_government_entity_transfers_900_btc_to/,0.0,0,2024-06-25 08:47:26,2024-06-28 01:33:39
CryptoMarkets,Only 6.5k BTC will be distributed to creditors of Mt. Gox,,https://www.reddit.com/r/CryptoMarkets/comments/1dnmbm4/only_65k_btc_will_be_distributed_to_creditors_of/,0.0,6,2024-06-24 15:39:20,2024-06-28 01:33:39
CryptoMarkets,Crypto and Stock Market Update 06.25,,https://www.reddit.com/r/CryptoMarkets/comments/1do4d2w/crypto_and_stock_market_update_0625/,0.0,0,2024-06-25 08:05:39,2024-06-28 01:33:39
CryptoMarkets,'Rich dad' Robert Kiyosaki sees Bitcoin dip as buying opportunity,,https://www.reddit.com/r/CryptoMarkets/comments/1do84i8/rich_dad_robert_kiyosaki_sees_bitcoin_dip_as/,0.7506,0,2024-06-25 11:01:28,2024-06-28 01:33:39
CryptoMarkets,"Trump Reportedly Discussing Participation In Bitcoin 2024 Conference, Move To Reinforce 'Crypto President' Image? - Benzinga",,https://www.reddit.com/r/CryptoMarkets/comments/1dnydp0/trump_reportedly_discussing_participation_in/,0.0,0,2024-06-25 01:25:16,2024-06-28 01:33:39
CryptoMarkets,Binance Freezes $5 Million in Funds Looted from Turkish Exchange After $54 Million Hack,,https://www.reddit.com/r/CryptoMarkets/comments/1dna1fy/binance_freezes_5_million_in_funds_looted_from/,-0.0258,18,2024-06-24 06:14:01,2024-06-28 01:33:39
